{
  "$schema": "https://json-schema.org/draft/2020-12/schema",
  "$id": "https://fiduciary-wire/schemas/weekly.schema.json",
  "title": "weekly/<YYYY-Www>.json",
  "description": "Weekly M&A recap (generated on Friday refreshes).",
  "type": "object",
  "properties": {
    "schema_version": {
      "const": 1
    },
    "generated_at": {
      "type": "string",
      "pattern": "^\\d{4}-\\d{2}-\\d{2}T\\d{2}:\\d{2}:\\d{2}Z$"
    },
    "week": {
      "type": "string",
      "pattern": "^\\d{4}-W\\d{2}$"
    },
    "start": {
      "type": "string",
      "pattern": "^\\d{4}-\\d{2}-\\d{2}$"
    },
    "end": {
      "type": "string",
      "pattern": "^\\d{4}-\\d{2}-\\d{2}$"
    },
    "deals": {
      "type": "array",
      "items": {
        "type": "object",
        "properties": {
          "cluster_id": {
            "type": "integer",
            "minimum": 0
          },
          "date": {
            "type": "string",
            "pattern": "^\\d{4}-\\d{2}-\\d{2}T\\d{2}:\\d{2}:\\d{2}Z$"
          },
          "headline": {
            "type": "string"
          },
          "acquirer": {
            "type": "object",
            "properties": {
              "name": {
                "type": [
                  "string",
                  "null"
                ]
              },
              "slug": {
                "type": [
                  "string",
                  "null"
                ],
                "pattern": "^[a-z0-9-]+$"
              },
              "crd": {
                "type": [
                  "string",
                  "null"
                ]
              }
            },
            "required": [
              "name",
              "slug",
              "crd"
            ],
            "additionalProperties": false
          },
          "target": {
            "type": "object",
            "properties": {
              "name": {
                "type": [
                  "string",
                  "null"
                ]
              },
              "slug": {
                "type": [
                  "string",
                  "null"
                ],
                "pattern": "^[a-z0-9-]+$"
              },
              "crd": {
                "type": [
                  "string",
                  "null"
                ]
              }
            },
            "required": [
              "name",
              "slug",
              "crd"
            ],
            "additionalProperties": false
          },
          "target_aum_usd": {
            "type": [
              "number",
              "null"
            ]
          },
          "target_aum_source": {
            "enum": [
              "headline",
              "sec",
              null
            ]
          },
          "deal_type": {
            "enum": [
              "acquisition",
              "stake",
              "merger",
              "recapitalization",
              null
            ]
          },
          "confidence": {
            "enum": [
              "high",
              "low"
            ]
          },
          "note": {
            "type": "string"
          },
          "press_release": {
            "type": "boolean"
          },
          "sources": {
            "type": "array",
            "items": {
              "type": "object",
              "properties": {
                "name": {
                  "type": "string"
                },
                "url": {
                  "type": "string",
                  "pattern": "^https?://"
                }
              },
              "required": [
                "name",
                "url"
              ],
              "additionalProperties": false
            }
          },
          "stage": {
            "enum": [
              "announced",
              "completed",
              "rumored",
              "bid",
              "terminated"
            ]
          },
          "value_usd": {
            "type": [
              "number",
              "null"
            ]
          },
          "industries": {
            "type": "array",
            "items": {
              "type": "string"
            },
            "minItems": 1
          }
        },
        "required": [
          "cluster_id",
          "date",
          "headline",
          "acquirer",
          "target",
          "target_aum_usd",
          "target_aum_source",
          "deal_type",
          "confidence",
          "note",
          "press_release",
          "sources"
        ],
        "additionalProperties": false
      }
    },
    "total_disclosed_aum_usd": {
      "type": [
        "number",
        "null"
      ]
    },
    "disclosed_aum_deals": {
      "type": "integer",
      "minimum": 0
    },
    "top_acquirers": {
      "type": "array",
      "items": {
        "type": "object",
        "properties": {
          "name": {
            "type": "string"
          },
          "slug": {
            "type": [
              "string",
              "null"
            ],
            "pattern": "^[a-z0-9-]+$"
          },
          "deals": {
            "type": "integer",
            "minimum": 1
          }
        },
        "required": [
          "name",
          "slug",
          "deals"
        ],
        "additionalProperties": false
      }
    },
    "paragraph": {
      "type": [
        "string",
        "null"
      ]
    },
    "ai": {
      "type": "boolean"
    },
    "total_disclosed_value_usd": {
      "type": [
        "number",
        "null"
      ]
    },
    "disclosed_value_deals": {
      "type": "integer",
      "minimum": 0
    },
    "industry_counts": {
      "type": "array",
      "items": {
        "type": "object",
        "additionalProperties": false,
        "required": [
          "industry",
          "deals"
        ],
        "properties": {
          "industry": {
            "type": "string"
          },
          "deals": {
            "type": "integer",
            "minimum": 1
          }
        }
      }
    }
  },
  "required": [
    "schema_version",
    "generated_at",
    "week",
    "start",
    "end",
    "deals",
    "total_disclosed_aum_usd",
    "disclosed_aum_deals",
    "top_acquirers",
    "paragraph",
    "ai"
  ],
  "additionalProperties": false
}
