{
 "schema_version": 1,
 "generated_at": "2026-10-17T04:12:21Z",
 "week": "2026-W42",
 "start": "2026-10-12",
 "end": "2026-10-16",
 "deals": [
  {
   "cluster_id": 861,
   "date": "2026-10-16T20:19:09Z",
   "headline": "Deals & Moves: WPCG-Backed Apella, Waverly Keep Acquiring",
   "acquirer": {
    "name": null,
    "slug": null,
    "crd": null
   },
   "target": {
    "name": null,
    "slug": null,
    "crd": null
   },
   "target_aum_usd": null,
   "target_aum_source": null,
   "deal_type": null,
   "confidence": "low",
   "note": "no deal pattern matched the headlines",
   "press_release": false,
   "sources": [
    {
     "name": "WealthManagement.com",
     "url": "https://www.wealthmanagement.com/ria-news/deals-moves-wpcg-backed-apella-waverly-keep-acquiring"
    }
   ]
  },
  {
   "cluster_id": 850,
   "date": "2026-10-16T11:00:00Z",
   "headline": "Family offices poured $68.3B into AI and RIA deals in Q3 2026",
   "acquirer": {
    "name": null,
    "slug": null,
    "crd": null
   },
   "target": {
    "name": null,
    "slug": null,
    "crd": null
   },
   "target_aum_usd": null,
   "target_aum_source": null,
   "deal_type": null,
   "confidence": "low",
   "note": "no deal pattern matched the headlines",
   "press_release": false,
   "sources": [
    {
     "name": "InvestmentNews",
     "url": "https://www.investmentnews.com/mergers-acquisitions/family-offices-poured-683b-into-ai-and-ria-deals-in-q3-2026/268624"
    }
   ]
  },
  {
   "cluster_id": 834,
   "date": "2026-10-15T18:03:13Z",
   "headline": "RIA M&A drops 17% in Q3 as mega sellers set new record, DeVoe says",
   "acquirer": {
    "name": null,
    "slug": null,
    "crd": null
   },
   "target": {
    "name": null,
    "slug": null,
    "crd": null
   },
   "target_aum_usd": null,
   "target_aum_source": null,
   "deal_type": null,
   "confidence": "low",
   "note": "no deal pattern matched the headlines",
   "press_release": false,
   "sources": [
    {
     "name": "InvestmentNews",
     "url": "https://www.investmentnews.com/ria-news/ria-ma-drops-17-in-q3-as-mega-sellers-set-new-record-devoe-says/268618"
    }
   ]
  },
  {
   "cluster_id": 805,
   "date": "2026-10-15T14:00:00Z",
   "headline": "Q3 M&A Deal Volume Cools, But Consolidators May Yet Drive a Record 2026",
   "acquirer": {
    "name": null,
    "slug": null,
    "crd": null
   },
   "target": {
    "name": null,
    "slug": null,
    "crd": null
   },
   "target_aum_usd": null,
   "target_aum_source": null,
   "deal_type": null,
   "confidence": "low",
   "note": "no deal pattern matched the headlines",
   "press_release": false,
   "sources": [
    {
     "name": "WealthManagement.com",
     "url": "https://www.wealthmanagement.com/ria-news/q3-m-a-deal-volume-cools-but-consolidators-may-yet-drive-a-record-2026"
    }
   ]
  },
  {
   "cluster_id": 752,
   "date": "2026-10-14T14:55:20Z",
   "headline": "NYC-Based Tax Firm CohnReznick to Add $8B West Coast Wealth Practice",
   "acquirer": {
    "name": null,
    "slug": null,
    "crd": null
   },
   "target": {
    "name": null,
    "slug": null,
    "crd": null
   },
   "target_aum_usd": null,
   "target_aum_source": null,
   "deal_type": null,
   "confidence": "low",
   "note": "no deal pattern matched the headlines",
   "press_release": false,
   "sources": [
    {
     "name": "WealthManagement.com",
     "url": "https://www.wealthmanagement.com/ria-news/nyc-based-tax-firm-cohnreznick-to-add-8b-west-coast-based-wealth-practice"
    }
   ]
  },
  {
   "cluster_id": 766,
   "date": "2026-10-14T10:39:00Z",
   "headline": "VestGen lands institutional capital to fuel Midwest wealth rollup",
   "acquirer": {
    "name": null,
    "slug": null,
    "crd": null
   },
   "target": {
    "name": null,
    "slug": null,
    "crd": null
   },
   "target_aum_usd": null,
   "target_aum_source": null,
   "deal_type": null,
   "confidence": "low",
   "note": "no deal pattern matched the headlines",
   "press_release": false,
   "sources": [
    {
     "name": "InvestmentNews",
     "url": "https://www.investmentnews.com/ria-news/vestgen-lands-institutional-capital-to-fuel-midwest-wealth-rollup/268585"
    }
   ]
  },
  {
   "cluster_id": 759,
   "date": "2026-10-14T10:00:00Z",
   "headline": "Captrust Adds $3B Hoge-Barrett Group from Truist",
   "acquirer": {
    "name": "Captrust",
    "slug": "captrust-175112",
    "crd": "175112"
   },
   "target": {
    "name": "Hoge-Barrett Group",
    "slug": null,
    "crd": null
   },
   "target_aum_usd": 3000000000.0,
   "target_aum_source": "headline",
   "deal_type": "acquisition",
   "confidence": "high",
   "note": "",
   "press_release": false,
   "sources": [
    {
     "name": "WealthManagement.com",
     "url": "https://www.wealthmanagement.com/ria-news/captrust-adds-3-billion-hoge-barrett-group"
    },
    {
     "name": "InvestmentNews",
     "url": "https://www.investmentnews.com/ria-news/captrust-adds-3b-truist-team-as-hoge-bets-on-employee-equity/268605"
    }
   ]
  },
  {
   "cluster_id": 706,
   "date": "2026-10-13T00:28:42Z",
   "headline": "No sooner does MassMutual sell control of Flourish than it massively buys its cash management services for its 6,000 brokers; odd timing explained by 'plumbing'",
   "acquirer": {
    "name": null,
    "slug": null,
    "crd": null
   },
   "target": {
    "name": null,
    "slug": null,
    "crd": null
   },
   "target_aum_usd": null,
   "target_aum_source": null,
   "deal_type": "acquisition",
   "confidence": "low",
   "note": "acquirer unclear (name too long); target unclear (not a proper name: 'its cash management services')",
   "press_release": false,
   "sources": [
    {
     "name": "RIABiz",
     "url": "https://riabiz.com/a/2026/10/13/no-sooner-does-massmutual-sell-control-of-flourish-than-it-massively-buys-its-cash-management-services-for-its-6000-brokers-odd-timing-explained-by-plumbing"
    }
   ]
  },
  {
   "cluster_id": 694,
   "date": "2026-10-12T15:26:05Z",
   "headline": "Goldman’s $2.3 Billion Deal Puts Tax-Smart ETFs Under Scrutiny",
   "acquirer": {
    "name": null,
    "slug": null,
    "crd": null
   },
   "target": {
    "name": null,
    "slug": null,
    "crd": null
   },
   "target_aum_usd": null,
   "target_aum_source": null,
   "deal_type": null,
   "confidence": "low",
   "note": "no deal pattern matched the headlines",
   "press_release": false,
   "sources": [
    {
     "name": "WealthManagement.com",
     "url": "https://www.wealthmanagement.com/etfs/goldman-s-2-3-billion-deal-puts-tax-smart-etfs-under-scrutiny"
    },
    {
     "name": "Financial Planning",
     "url": "https://www.financial-planning.com/articles/goldmans-2-3b-deal-puts-tax-smart-etfs-under-scrutiny"
    }
   ]
  }
 ],
 "total_disclosed_aum_usd": 3000000000.0,
 "disclosed_aum_deals": 1,
 "top_acquirers": [
  {
   "name": "Captrust",
   "slug": "captrust-175112",
   "deals": 1
  }
 ],
 "paragraph": null,
 "ai": false
}
